[
  {
    "videoId": "dQw4w9WgXcQ",
    "channelId": "UCBcRF18a7Qf58cCRy5xuWwQ",
    "title": "Scenic Train Ride Through the Swiss Alps — 4K Cab View",
    "scheduledAt": "2026-03-21T14:00:00.000Z",
    "block": "afternoon",
    "updatedAt": "2026-03-21T06:21:01.536Z",
    "channelTitle": "TRAVIS",
    "duration": "PT2H15M00S",
    "liveBroadcastContent": "none"
  }
]
