[
  {
    "videoId": "dQw4w9WgXcQ",
    "channelId": "UCBcRF18a7Qf58cCRy5xuWwQ",
    "title": "Scenic Train Ride Through the Swiss Alps — 4K Cab View",
    "channelTitle": "TRAVIS",
    "scheduledAt": "2026-03-20T18:00:00Z",
    "duration": "PT2H15M00S",
    "liveBroadcastContent": "none",
    "block": "evening",
    "updatedAt": "2026-03-20T10:00:00Z"
  }
]
